<?xml version="1.0" encoding="UTF-8"?>
<xsd:schema xmlns:xsd="http://www.w3.org/2001/XMLSchema" xmlns:od="urn:schemas-microsoft-com:officedata">
<xsd:element name="dataroot">
<xsd:complexType>
<xsd:sequence>
<xsd:element ref="Exemplare" minOccurs="0" maxOccurs="unbounded"/>
</xsd:sequence>
<xsd:attribute name="generated" type="xsd:dateTime"/>
</xsd:complexType>
</xsd:element>
<xsd:element name="Exemplare">
<xsd:annotation>
<xsd:appinfo>
<od:index index-name="PrimaryKey" index-key="ID " primary="yes" unique="yes" clustered="no" order="asc"/>
<od:index index-name="Werk" index-key="Werk " primary="no" unique="no" clustered="no" order="asc"/>
<od:index index-name="WerkeExemplare" index-key="Werk " primary="no" unique="no" clustered="no" order="asc"/>
<od:tableProperty name="PublishToWeb" type="2" value="1"/>
<od:tableProperty name="Orientation" type="2" value="0"/>
<od:tableProperty name="OrderByOn" type="1" value="0"/>
<od:tableProperty name="NameMap" type="11" value="CswOVQAAAAAEbslOziH3TJb8B2oQNZMpAAAAAIkhJTZzAeZAAAAAAAAAAABFAHgA
ZQBtAHAAbABhAHIAZQAAAAAAAADEpS2hchdCRJ7D9gpTm7iOBwAAAARuyU7OIfdM
lvwHahA1kylJAEQAAAAAAAAA1PC/tJIFCkKtibOnAn4pYQAAAAAsoJ87cwHmQAAA
AAAAAAAAVwBlAHIAawBlAAAAAAAAAHiqVWgfnZxImSp5rriIxVUHAAAA1PC/tJIF
CkKtibOnAn4pYUkARAAAAAAAAAAod5p9JrOFR78Z2YpokP33BwAAANTwv7SSBQpC
rYmzpwJ+KWFTAG8AcgB0AGkAZQByAHQAaQB0AGUAbAAAAAAAAADhlxc4NTqZT7gs
6AglolshBwAAANTwv7SSBQpCrYmzpwJ+KWFSAGUAaQBoAGUAAAAAAAAA1neZpyNZ
EkSSGhSwucTlKQcAAADU8L+0kgUKQq2Js6cCfilhSgBhAGgAcgAAAAAAAAC+6hei
km1gRZTTWo3CKrgMBwAAAARuyU7OIfdMlvwHahA1kylXAGUAcgBrAAAAAAAAALO/
LL8DnXFPkEXVlFn1q+sHAAAABG7JTs4h90yW/AdqEDWTKUIAaQBiAGwAaQBvAC0A
TgByAAAAAAAAAID9pxyWmBhHiV5GyXPg0FcHAAAABG7JTs4h90yW/AdqEDWTKUEA
dQB0AG8AcABzAGkAZQAAAAAAAADbYacYks8gTJ2p0ZON6lIWBwAAAARuyU7OIfdM
lvwHahA1kylTAHQAYQB0AHUAcwAAAAAAAADxODiY1DVTRbShSl2h99IvBwAAAARu
yU7OIfdMlvwHahA1kylVAFIATAAAAAAAAABRBqFLh0Q7SaFSRXIKfWT5BwAAAARu
yU7OIfdMlvwHahA1kylTAHQAYQBuAGQAbwByAHQAIAB1AG4AZAAgAFMAaQBnAG4A
YQB0AHUAcgAAAAAAAAAZGRNySMimSbZDP47l5AoDBwAAAARuyU7OIfdMlvwHahA1
kylBAG4AbQBlAHIAawB1AG4AZwBlAG4AAAAAAAAAdX6b0taRp0eqg5KzzCvjHgcA
AAAEbslOziH3TJb8B2oQNZMpRABFAFAAUgBfAEEATABNAE4AUgAAAAAAAAAAAAAA
AAAAAAAAAAAAAAAADAAAAAUAAAAAAAAAAAAAAAAAAAAAAA==
"/>
<od:tableProperty name="DefaultView" type="2" value="2"/>
<od:tableProperty name="GUID" type="9" value="BG7JTs4h90yW/AdqEDWTKQ==
"/>
<od:tableProperty name="DisplayViewsOnSharePointSite" type="2" value="1"/>
<od:tableProperty name="TotalsRow" type="1" value="0"/>
<od:tableProperty name="FilterOnLoad" type="1" value="0"/>
<od:tableProperty name="OrderByOnLoad" type="1" value="1"/>
<od:tableProperty name="HideNewField" type="1" value="0"/>
<od:tableProperty name="BackTint" type="6" value="100"/>
<od:tableProperty name="BackShade" type="6" value="100"/>
<od:tableProperty name="ThemeFontIndex" type="4" value="1"/>
<od:tableProperty name="AlternateBackThemeColorIndex" type="4" value="1"/>
<od:tableProperty name="AlternateBackTint" type="6" value="100"/>
<od:tableProperty name="AlternateBackShade" type="6" value="95"/>
<od:tableProperty name="ReadOnlyWhenDisconnected" type="1" value="0"/>
<od:tableProperty name="DatasheetGridlinesThemeColorIndex" type="4" value="3"/>
<od:tableProperty name="DatasheetForeThemeColorIndex" type="4" value="0"/>
</xsd:appinfo>
</xsd:annotation>
<xsd:complexType>
<xsd:sequence>
<xsd:element name="ID" minOccurs="1" od:jetType="autonumber" od:sqlSType="int" od:autoUnique="yes" od:nonNullable="yes" type="xsd:int">
<xsd:annotation>
<xsd:appinfo>
<od:fieldProperty name="ColumnWidth" type="3" value="-1"/>
<od:fieldProperty name="ColumnOrder" type="3" value="1"/>
<od:fieldProperty name="ColumnHidden" type="1" value="0"/>
<od:fieldProperty name="TextAlign" type="2" value="0"/>
<od:fieldProperty name="AggregateType" type="4" value="-1"/>
<od:fieldProperty name="ResultType" type="2" value="0"/>
<od:fieldProperty name="CurrencyLCID" type="4" value="0"/>
<od:fieldProperty name="GUID" type="9" value="xKUtoXIXQkSew/YKU5u4jg==
"/>
</xsd:appinfo>
</xsd:annotation>
</xsd:element>
<xsd:element name="Werk" minOccurs="1" od:jetType="longinteger" od:sqlSType="int" od:nonNullable="yes" type="xsd:int">
<xsd:annotation>
<xsd:appinfo>
<od:fieldProperty name="GUID" type="9" value="vuoXopJtYEWU01qNwiq4DA==
"/>
<od:fieldProperty name="ColumnWidth" type="3" value="-1"/>
<od:fieldProperty name="ColumnOrder" type="3" value="2"/>
<od:fieldProperty name="ColumnHidden" type="1" value="0"/>
<od:fieldProperty name="DecimalPlaces" type="2" value="255"/>
<od:fieldProperty name="Required" type="1" value="1"/>
<od:fieldProperty name="DisplayControl" type="3" value="111"/>
<od:fieldProperty name="RowSourceType" type="10" value="Table/Query"/>
<od:fieldProperty name="RowSource" type="12" value="SELECT [Werke].[ID], [Werke].[Sortiertitel], [Werke].[Reihe], [Werke].[Jahr] FROM Werke ORDER BY [Sortiertitel], [Reihe], [Jahr]; "/>
<od:fieldProperty name="BoundColumn" type="3" value="1"/>
<od:fieldProperty name="ColumnCount" type="3" value="4"/>
<od:fieldProperty name="ColumnHeads" type="1" value="0"/>
<od:fieldProperty name="ColumnWidths" type="10" value="0;1860;1440;1440"/>
<od:fieldProperty name="ListRows" type="3" value="16"/>
<od:fieldProperty name="ListWidth" type="10" value="4740Twip"/>
<od:fieldProperty name="LimitToList" type="1" value="1"/>
<od:fieldProperty name="AllowMultipleValues" type="1" value="0"/>
<od:fieldProperty name="TextAlign" type="2" value="0"/>
<od:fieldProperty name="AllowValueListEdits" type="1" value="1"/>
<od:fieldProperty name="AggregateType" type="4" value="-1"/>
<od:fieldProperty name="ShowOnlyRowSourceValues" type="1" value="0"/>
<od:fieldProperty name="ResultType" type="2" value="0"/>
<od:fieldProperty name="CurrencyLCID" type="4" value="0"/>
</xsd:appinfo>
</xsd:annotation>
</xsd:element>
<xsd:element name="Biblio-Nr" minOccurs="0" od:jetType="longinteger" od:sqlSType="int" type="xsd:int">
<xsd:annotation>
<xsd:appinfo>
<od:fieldProperty name="ColumnWidth" type="3" value="-1"/>
<od:fieldProperty name="ColumnOrder" type="3" value="3"/>
<od:fieldProperty name="ColumnHidden" type="1" value="0"/>
<od:fieldProperty name="DecimalPlaces" type="2" value="255"/>
<od:fieldProperty name="DefaultValue" type="12" value="0"/>
<od:fieldProperty name="Required" type="1" value="0"/>
<od:fieldProperty name="DisplayControl" type="3" value="109"/>
<od:fieldProperty name="TextAlign" type="2" value="0"/>
<od:fieldProperty name="AggregateType" type="4" value="-1"/>
<od:fieldProperty name="ResultType" type="2" value="0"/>
<od:fieldProperty name="CurrencyLCID" type="4" value="0"/>
<od:fieldProperty name="GUID" type="9" value="s78svwOdcU+QRdWUWfWr6w==
"/>
</xsd:appinfo>
</xsd:annotation>
</xsd:element>
<xsd:element name="Autopsie" minOccurs="1" od:jetType="yesno" od:sqlSType="bit" od:nonNullable="yes" type="xsd:boolean">
<xsd:annotation>
<xsd:appinfo>
<od:fieldProperty name="DisplayControl" type="3" value="106"/>
<od:fieldProperty name="ColumnWidth" type="3" value="-1"/>
<od:fieldProperty name="ColumnOrder" type="3" value="4"/>
<od:fieldProperty name="ColumnHidden" type="1" value="0"/>
<od:fieldProperty name="Format" type="10" value="Yes/No"/>
<od:fieldProperty name="DefaultValue" type="12" value="No"/>
<od:fieldProperty name="TextAlign" type="2" value="0"/>
<od:fieldProperty name="AggregateType" type="4" value="-1"/>
<od:fieldProperty name="ResultType" type="2" value="0"/>
<od:fieldProperty name="CurrencyLCID" type="4" value="0"/>
<od:fieldProperty name="GUID" type="9" value="gP2nHJaYGEeJXkbJc+DQVw==
"/>
</xsd:appinfo>
</xsd:annotation>
</xsd:element>
<xsd:element name="Status" minOccurs="0" od:jetType="complex" od:jetComplexType="MSysComplexType_Text" maxOccurs="unbounded">
<xsd:annotation>
<xsd:appinfo>
<od:fieldProperty name="AllowMultipleValues" type="1" value="1"/>
<od:fieldProperty name="GUID" type="9" value="22GnGJLPIEydqdGTjepSFg==
"/>
<od:fieldProperty name="ColumnWidth" type="3" value="2040"/>
<od:fieldProperty name="ColumnOrder" type="3" value="5"/>
<od:fieldProperty name="ColumnHidden" type="1" value="0"/>
<od:fieldProperty name="Required" type="1" value="0"/>
<od:fieldProperty name="AllowZeroLength" type="1" value="1"/>
<od:fieldProperty name="DisplayControl" type="3" value="111"/>
<od:fieldProperty name="RowSourceType" type="10" value="Value List"/>
<od:fieldProperty name="RowSource" type="12" value="&quot;Origninal vorhanden&quot;;&quot;Reprint vorhanden&quot;;&quot;Kopie vorhanden&quot;;&quot;Fremde Herkunft&quot;;&quot;URL&quot;"/>
<od:fieldProperty name="BoundColumn" type="3" value="1"/>
<od:fieldProperty name="ColumnCount" type="3" value="1"/>
<od:fieldProperty name="ColumnHeads" type="1" value="0"/>
<od:fieldProperty name="ColumnWidths" type="10" value="1440"/>
<od:fieldProperty name="ListRows" type="3" value="16"/>
<od:fieldProperty name="ListWidth" type="10" value="1440Twip"/>
<od:fieldProperty name="LimitToList" type="1" value="1"/>
<od:fieldProperty name="IMEMode" type="2" value="0"/>
<od:fieldProperty name="IMESentenceMode" type="2" value="3"/>
<od:fieldProperty name="UnicodeCompression" type="1" value="1"/>
<od:fieldProperty name="TextAlign" type="2" value="0"/>
<od:fieldProperty name="AllowValueListEdits" type="1" value="1"/>
<od:fieldProperty name="AggregateType" type="4" value="-1"/>
<od:fieldProperty name="ShowOnlyRowSourceValues" type="1" value="0"/>
<od:fieldProperty name="ResultType" type="2" value="0"/>
<od:fieldProperty name="CurrencyLCID" type="4" value="0"/>
</xsd:appinfo>
</xsd:annotation>
<xsd:complexType>
<xsd:sequence>
<xsd:element name="Value" minOccurs="0" od:jetType="text" od:sqlSType="nvarchar">
<xsd:simpleType>
<xsd:restriction base="xsd:string">
<xsd:maxLength value="255"/>
</xsd:restriction>
</xsd:simpleType>
</xsd:element>
</xsd:sequence>
</xsd:complexType>
</xsd:element>
<xsd:element name="URL" minOccurs="0" od:jetType="hyperlink" od:sqlSType="ntext" od:hyperlink="yes">
<xsd:annotation>
<xsd:appinfo>
<od:fieldProperty name="GUID" type="9" value="8Tg4mNQ1U0W0oUpdoffSLw==
"/>
<od:fieldProperty name="ColumnWidth" type="3" value="2490"/>
<od:fieldProperty name="ColumnOrder" type="3" value="6"/>
<od:fieldProperty name="ColumnHidden" type="1" value="0"/>
<od:fieldProperty name="Required" type="1" value="0"/>
<od:fieldProperty name="AllowZeroLength" type="1" value="1"/>
<od:fieldProperty name="IMEMode" type="2" value="0"/>
<od:fieldProperty name="IMESentenceMode" type="2" value="3"/>
<od:fieldProperty name="UnicodeCompression" type="1" value="1"/>
<od:fieldProperty name="TextAlign" type="2" value="0"/>
<od:fieldProperty name="AppendOnly" type="1" value="0"/>
<od:fieldProperty name="AggregateType" type="4" value="-1"/>
<od:fieldProperty name="ResultType" type="2" value="0"/>
<od:fieldProperty name="CurrencyLCID" type="4" value="0"/>
</xsd:appinfo>
</xsd:annotation>
<xsd:simpleType>
<xsd:restriction base="xsd:string">
<xsd:maxLength value="536870910"/>
</xsd:restriction>
</xsd:simpleType>
</xsd:element>
<xsd:element name="Standort_x0020_und_x0020_Signatur" minOccurs="0" od:jetType="memo" od:sqlSType="ntext">
<xsd:annotation>
<xsd:appinfo>
<od:fieldProperty name="GUID" type="9" value="UQahS4dEO0mhUkVyCn1k+Q==
"/>
<od:fieldProperty name="ColumnWidth" type="3" value="4080"/>
<od:fieldProperty name="ColumnOrder" type="3" value="7"/>
<od:fieldProperty name="ColumnHidden" type="1" value="0"/>
<od:fieldProperty name="Required" type="1" value="0"/>
<od:fieldProperty name="AllowZeroLength" type="1" value="1"/>
<od:fieldProperty name="IMEMode" type="2" value="0"/>
<od:fieldProperty name="IMESentenceMode" type="2" value="3"/>
<od:fieldProperty name="UnicodeCompression" type="1" value="1"/>
<od:fieldProperty name="TextFormat" type="2" value="0"/>
<od:fieldProperty name="TextAlign" type="2" value="0"/>
<od:fieldProperty name="AppendOnly" type="1" value="0"/>
<od:fieldProperty name="AggregateType" type="4" value="-1"/>
<od:fieldProperty name="ResultType" type="2" value="0"/>
<od:fieldProperty name="CurrencyLCID" type="4" value="0"/>
</xsd:appinfo>
</xsd:annotation>
<xsd:simpleType>
<xsd:restriction base="xsd:string">
<xsd:maxLength value="536870910"/>
</xsd:restriction>
</xsd:simpleType>
</xsd:element>
<xsd:element name="Anmerkungen" minOccurs="0" od:jetType="memo" od:sqlSType="ntext" od:textFormat="1">
<xsd:annotation>
<xsd:appinfo>
<od:fieldProperty name="TextFormat" type="2" value="1"/>
<od:fieldProperty name="ColumnWidth" type="3" value="3540"/>
<od:fieldProperty name="ColumnOrder" type="3" value="8"/>
<od:fieldProperty name="ColumnHidden" type="1" value="0"/>
<od:fieldProperty name="Required" type="1" value="0"/>
<od:fieldProperty name="AllowZeroLength" type="1" value="1"/>
<od:fieldProperty name="IMEMode" type="2" value="0"/>
<od:fieldProperty name="IMESentenceMode" type="2" value="3"/>
<od:fieldProperty name="UnicodeCompression" type="1" value="1"/>
<od:fieldProperty name="TextAlign" type="2" value="0"/>
<od:fieldProperty name="AppendOnly" type="1" value="0"/>
<od:fieldProperty name="AggregateType" type="4" value="-1"/>
<od:fieldProperty name="ResultType" type="2" value="0"/>
<od:fieldProperty name="CurrencyLCID" type="4" value="0"/>
<od:fieldProperty name="GUID" type="9" value="GRkTckjIpkm2Qz+O5eQKAw==
"/>
</xsd:appinfo>
</xsd:annotation>
<xsd:simpleType>
<xsd:restriction base="xsd:string">
<xsd:maxLength value="536870910"/>
</xsd:restriction>
</xsd:simpleType>
</xsd:element>
<xsd:element name="DEPR_ALMNR" minOccurs="0" od:jetType="text" od:sqlSType="nvarchar">
<xsd:annotation>
<xsd:appinfo>
<od:fieldProperty name="ColumnWidth" type="3" value="-1"/>
<od:fieldProperty name="ColumnOrder" type="3" value="9"/>
<od:fieldProperty name="ColumnHidden" type="1" value="0"/>
<od:fieldProperty name="Required" type="1" value="0"/>
<od:fieldProperty name="AllowZeroLength" type="1" value="1"/>
<od:fieldProperty name="DisplayControl" type="3" value="109"/>
<od:fieldProperty name="IMEMode" type="2" value="0"/>
<od:fieldProperty name="IMESentenceMode" type="2" value="3"/>
<od:fieldProperty name="UnicodeCompression" type="1" value="1"/>
<od:fieldProperty name="TextAlign" type="2" value="0"/>
<od:fieldProperty name="AggregateType" type="4" value="-1"/>
<od:fieldProperty name="ResultType" type="2" value="0"/>
<od:fieldProperty name="CurrencyLCID" type="4" value="0"/>
<od:fieldProperty name="GUID" type="9" value="dX6b0taRp0eqg5KzzCvjHg==
"/>
</xsd:appinfo>
</xsd:annotation>
<xsd:simpleType>
<xsd:restriction base="xsd:string">
<xsd:maxLength value="255"/>
</xsd:restriction>
</xsd:simpleType>
</xsd:element>
</xsd:sequence>
</xsd:complexType>
</xsd:element>
</xsd:schema>
