<?xml version="1.0" encoding="UTF-8"?>
<dataroot xmlns:od="urn:schemas-microsoft-com:officedata" xmlns:xsi="http://www.w3.org/2001/XMLSchema-instance"  xsi:noNamespaceSchemaLocation="Exemplare.xsd" generated="2023-05-21T18:34:25">
<Exemplare>
<ID>1</ID>
<Werk>3</Werk>
<Biblio-Nr>100127</Biblio-Nr>
<Autopsie>1</Autopsie>
<Status>
<Value>Origninal vorhanden</Value>
</Status>
</Exemplare>
<Exemplare>
<ID>2</ID>
<Werk>2</Werk>
<Biblio-Nr>100128</Biblio-Nr>
<Autopsie>1</Autopsie>
<Status>
<Value>Fremde Herkunft</Value>
</Status>
<Status>
<Value>Origninal vorhanden</Value>
</Status>
</Exemplare>
</dataroot>
